"KEY","en","notes","sp","fr","de","it","pt-br"
"CAT_EMBARK_QUOTES_BUTCHER_3","要血！一定要新鮮！","","¡Necesito sangre fresca!","Du sang neuf&nbsp;! Il doit être tout frais&nbsp;!","Ich brauche Blut! Frisches Blut!","Ho bisogno di sangue! Dev'essere fresco!","Preciso de sangue! Fresco!"
"CAT_EMBARK_QUOTES_BUTCHER_4","該你上鉤了！","","¡Os voy a echar el gancho!","Je vais te mettre au crochet&nbsp;!","Ihr kommt alle an den Haken!","È ora di agganciarti!","Hora de se enganchar!"
"CAT_EMBARK_QUOTES_BUTCHER_5","你看起來很好吃！","","¡Tienes una pinta muy apetecible!","T'es à croquer&nbsp;!","Ihr seht köstlich aus!","Hai un aspetto prelibato!","Você parece ter um gosto bom!"
"CAT_EMBARK_QUOTES_BUTCHER_6","呼嚕呼嚕！","","¡Oinc, oinc!","Gruik, gruik&nbsp;!","Grunz, grunz!","Oink oink!","Oinc oinc!"
"CAT_EMBARK_QUOTES_BUTCHER_7","各種小畜生混在一起，才做得出屠夫的美味炸餅！","","¡Me hacen falta muchas criaturas para preparar una fritura!","Il faut toutes sortes de bestioles pour faire de bons beignets&nbsp;!","Jetzt geht‘s um die Wurst!","Ci vogliono bestiole di ogni tipo per preparare le frittelle del macellaio!","É preciso todo tipo de criatura para um açougueiro fazer uma fritura!"
"CAT_EMBARK_QUOTES_BUTCHER_8","肉就是肉，貓總得吃飯！","","Cuando el hambre aprieta, cualquier carne alimenta.","Un chat, ça mange de la viande&nbsp;!","Fleisch ist Fleisch und wir Katzen müssen ja irgendwie überleben!","La carne è carne e un gatto deve mangiare!","Carne é carne e gatos precisam comer!"
"CAT_EMBARK_QUOTES_BUTCHER_9","我要配蠶豆和上好奇揚地，吃掉他們的肝。","","Me comeré sus hígados acompañados de habas y un buen chianti.","Je mangerai leurs foies avec des fèves au beurre et un bon vin de Chianti.","Ich werde ihre Lebern mit ein paar Fava-Bohnen und einem hervorragenden Chianti essen.","Mangerò i loro fegati con delle fave e un buon Chianti.","Vou comer seus fígados com vagem e e um bom vinho."
"CAT_EMBARK_QUOTES_BUTCHER_10","鉤子就是家人！","","¡Somos una familia con mucho gancho!","Le crochet, c'est avant tout l'esprit de famille&nbsp;!","Der Haken gehört zur Familie!","L'uncino è casa!","O gancho é minha família!"
"CAT_EMBARK_QUOTES_DRUID_1","走吧，去找些新朋友！","","¡Vamos a hacer amiguitos nuevos!","Allons nous faire de nouveaux amis&nbsp;!","Suchen wir uns ein paar neue Freunde!","Andiamo a farci dei nuovi amici!","Vamos fazer novos amigos!"
"CAT_EMBARK_QUOTES_DRUID_2","我的小夥伴會帶我們走向勝利！","","¡Mis amiguitos nos guiarán hacia la victoria!","Mes petits amis nous guideront jusqu'à la victoire&nbsp;!","Meine kleinen Freunde werden uns zum Sieg führen!","I miei piccoli amici ci guideranno alla vittoria!","Meus amiguinhos vão nos guiar para a vitória!"
"CAT_EMBARK_QUOTES_DRUID_3","要做愛，不要作戰！","","¡Haced el amor, no la guerra!","Faites l'amour, pas la guerre&nbsp;!","Macht Liebe statt Krieg!","Fate l'amore, non la guerra!","Façam amor, não guerra!"
"CAT_EMBARK_QUOTES_DRUID_4","和平不是終點，和平就是道路！","","La paz no es el destino, sino el camino.","Il n'y a pas de chemin vers la paix, la paix est le chemin&nbsp;!","Frieden ist nicht das Ziel. Frieden ist der Weg!","La pace non è la meta. La pace è la via!","A paz não é o destino. A paz é o caminho!"
"CAT_EMBARK_QUOTES_DRUID_5","成為你希望在世界上看到的改變。","","Conviértete en el cambio que quieres ver en el mundo.","Soyez le changement que vous voulez voir dans le monde.","Sei du selbst die Veränderung, die du dir wünschst für diese Welt.","Sii il cambiamento che desideri vedere nel mondo.","Seja a mudança que você deseja ver no mundo."
"CAT_EMBARK_QUOTES_DRUID_6","人生是旅程，不是終點。","","La vida es un viaje, no el destino.","La vie est un voyage, pas une destination.","Der Weg ist das Ziel.","La vita è un viaggio, non una destinazione.","A vida é uma jornada, não um destino."
"CAT_EMBARK_QUOTES_DRUID_7","讓我們一起唱和平之歌！","","¡Entonemos canciones de paz!","Chantons tous des chansons de paix&nbsp;!","Lasst uns doch alle friedlich singen!","Cantiamo tutti canzoni di pace!","Vamos todos cantar uma canção de paz!"
"CAT_EMBARK_QUOTES_DRUID_8","我看見那個音樂人了！","","¡La vida son sonrisas y lágrimas!","Je peux voir la musique, man&nbsp;!","Ich kann die Musik sehen, Mann!","Riesco a vedere la musica!","Eu consigo ver a música, cara!"
"CAT_EMBARK_QUOTES_DRUID_9","Dave？Dave 不在這，老兄。","","¿Dave? Dave no está, colega.","Dave&nbsp;? Dave est pas là, man.","Ach du scheiße, bin ich breit.","Dave? Dave non c'è.","Dave? Dave não está aqui, cara."
"CAT_EMBARK_QUOTES_DRUID_10","會唱歌的人能把煩惱嚇跑！","","¡El que canta su mal espanta!","Celui qui chante fait fuir ses malheurs&nbsp;!","Wenn man laut genug singt, verschwinden alle Sorgen!","Colui che canta scaccia via i suoi guai!","Quem canta, seus males espanta!"
"CAT_EMBARK_QUOTES_TINKERER_1","出發吧，電到極限！","","¡Salid a dar calambrazos!","Faites-moi confiance, j'ai la science infuse.","Warum liegt hier eigentlich Stroh?","Esci e scatenati più che puoi!","Vá até lá e mande ver!"
"CAT_EMBARK_QUOTES_TINKERER_2","我剛想到史上最棒的點子！","","¡Se me acaba de encender la bombilla!","Je viens d'avoir l'idée du siècle&nbsp;!","Ich hatte gerade die beste Idee überhaupt!","Ho appena avuto l'idea migliore di sempre!","Eu acabei de ter a melhor ideia de todas!"
"CAT_EMBARK_QUOTES_TINKERER_3","尤里卡！不對，這行不通……","","¡Eureka! No, para el carro. No funciona...","Eurêka&nbsp;! Non, attends... ça ne marchera pas...","Heureka! Nein, warte, das funktioniert nicht&nbsp;…","Eureka! No, aspetta, non funzionerà...","Eureka! Não, espera, isso não vai funcionar..."
"CAT_EMBARK_QUOTES_TINKERER_4","知識有限，想像力環抱世界！","","El conocimiento es limitado, pero la imaginación abarca el mundo entero.","La connaissance est limitée, contrairement à l'imagination&nbsp;!","Wissen ist begrenzt. Der Einfallsreichtum ist es, der alle Grenzen sprengt!","La conoscenza è limitata. L'immaginazione abbraccia il mondo!","O conhecimento é limitado. A imaginação envolve o mundo!"
"CAT_EMBARK_QUOTES_TINKERER_5","需求是發明之母！","","Los mejores inventos surgen de la necesidad.","La nécessité est la mère de l'invention&nbsp;!","Die Notwendigkeit ist die Mutter der Erfindung!","La necessità è la madre dell'invenzione!","A necessidade é a mãe das ideias!"
"CAT_EMBARK_QUOTES_TINKERER_6","預測未來最好的方法，就是發明它！","","La mejor manera de predecir el futuro es creándolo.","La meilleure façon de prédire l'avenir, c'est de l'inventer&nbsp;!","Die beste Art, die Zukunft vorauszusehen, ist sie selbst zu erfinden!","Il modo migliore per prevedere il futuro è inventarlo!","A melhor maneira de prever o futuro é inventá-lo!"
"CAT_EMBARK_QUOTES_TINKERER_7","敵人看到我們一定會嚇到放電！","","¡Nuestros enemigos se caerán de culo en cuanto nos vean!","Nos ennemis seront choqués de nous voir&nbsp;!","Unsere Gegner werden buchstäblich schockiert sein, uns zu sehen!","I nostri nemici saranno scioccati nel vederci!","Nossos inimigos vão ficar chocados ao nos ver!"
"CAT_EMBARK_QUOTES_TINKERER_8","我正在充能！","","¡Me estoy recargando!","Je recharge mes batteries&nbsp;!","Alles aufgeladen!","Mi sto caricando!","Estou carregando!"
"CAT_EMBARK_QUOTES_TINKERER_9","我的機器人會擊潰敵人！","","¡Mis robots superarán a nuestros rivales!","Mes robots vaincront nos ennemis&nbsp;!","Meine Roboter werden unsere Feinde schlagen!","I miei robot sconfiggeranno i nostri nemici!","Meus robôs vão derrotar nossos inimigos!"
"CAT_EMBARK_QUOTES_TINKERER_10","我超愛動力手套，爛得超讚。","","Me encanta el guante de poder. Es la caña.","J'adore le Power Glove, il est tellement naze.","Ich liebe den Datenhandschuh. Er ist so schlecht.","Adoro il power glove, è veramente pessimo.","Eu adoro a luva de energia. Ela é tão malvada."
"CAT_EMBARK_QUOTES_MONK_1","脈輪會指引我們。","","Los chakras nos guían.","Les chakras nous guident.","Mögen die Chakras uns leiten.","I chakra ci guidano.","Que os chakras nos guiem."
"CAT_EMBARK_QUOTES_MONK_2","除了自己，沒人能拯救我們。這條路只能我們自己走。","","Nadie nos puede salvar. Nosotros hacemos nuestro propio camino.","On ne peut être sauvé que par soi-même. C'est un travail intérieur avant tout.","Niemand kann uns retten, nur wir selbst. Wir sind es, die den Weg gehen müssen.","Nessuno può salvarci se non noi stessi. Dobbiamo percorrere il cammino da soli.","Ninguém pode nos salvar além de nós mesmos. Nós precisamos seguir o caminho."
"CAT_EMBARK_QUOTES_MONK_3","冥想帶來智慧；不冥想，留下無明。","","La meditación nos hace sabios; la falta de meditación nos hace ignorantes.","La méditation engendre la sagesse. Son absence laisse place à l'ignorance.","Meditation führt zu Weisheit. Ohne bleiben wir im Dunkeln.","La meditazione porta saggezza. La sua mancanza lascia ignoranza.","A meditação traz sabedoria. A falta dela, deixa a ignorância."
"CAT_EMBARK_QUOTES_MONK_4","走路時，要像用雙腳親吻大地！","","Camina como si besaras el suelo con los pies.","Marchez comme si chacun de vos pas embrassait la Terre.","Schreitet voran, als küsstet ihr die Erde mit euren Füßen!","Cammina come se stessi baciando la Terra con i piedi!","Antes como se estivesse beijando a terra sob seus pés!"
"CAT_EMBARK_QUOTES_MONK_5","深呼吸，讓心回到身體裡。","","Respira hondo para que cuerpo y mente sean uno.","Prenez une profonde inspiration pour reconnecter l'esprit au corps.","Tief einatmen, dann kehrt euer Geist in euren Körper zurück.","Respira profondamente per riportare la mente al tuo corpo.","Inspire profundamente e traga sua mente para o lar do seu corpo."
"CAT_EMBARK_QUOTES_MONK_6","我之皮如鐵，我之魂如風！","","Mi piel es de hierro y mi alma sopla como el viento.","Ma peau est comme le fer, mon âme est pareille au vent&nbsp;!","Meine Haut ist Eisen, meine Seele der Wind!","La mia pelle è come il ferro e la mia anima come il vento!","Minha pele é dura como ferro e minha alma leve como o vento!"
"CAT_EMBARK_QUOTES_MONK_7","先打敗我的昇龍拳，你們才有機會！","","¡No tienen nada que hacer contra mi puñetazo del dragón!","Ils vont goûter à mon poing du dragon&nbsp;!","Sie müssen meinen Drachenschlag besiegen, um eine Chance zu haben!","Dovranno sconfiggere il mio pugno del drago per avere una possibilità!","É preciso derrotar o punho do dragão para ter uma chance!"
"CAT_EMBARK_QUOTES_MONK_8","別為勝利而戰，為精進而戰。勝利自會到來。","","No se lucha para vencer, sino para mejorar. La victoria llegará.","Ne vous battez pas pour gagner, battez-vous pour vous améliorer. La victoire en découlera.","Kämpfe nicht für den Sieg, kämpfe, um dich zu verbessern. Der Sieg folgt von selbst.","Non combattere per la vittoria, combatti per migliorare. La vittoria arriverà.","Não lute pela vitória, lute para melhorar. A vitória é uma consequência."
"CAT_EMBARK_QUOTES_JESTER_1","跟我唸一遍！","","¡Repetid conmigo!","Répétez après moi&nbsp;!","Sprecht mir nach!","Ripeti dopo di me!","Repita comigo!"
"CAT_EMBARK_QUOTES_JESTER_2","我們活在一個社會裡！LOL","","¡Vivimos en sociedad! Me meo de la risa.","Les jeux vidéo ont ruiné ma vie. Il m'en reste deux.","Wir leben in einer Gesellschaft! LOL","Viviamo in una società! LOL","Nós vivemos em sociedade! LOL"
"CAT_EMBARK_QUOTES_JESTER_3","哈 哈哈哈哈哈！","","¡Jua, jua, jua, jua!","Ha HA HA HA HA HA&nbsp;!","Ha HAHAHAHAHA!","Ah AHAHAHAHAHA!","Ha HAHAHAHAHA!"
"CAT_EMBARK_QUOTES_JESTER_4","我有個笑話要講給你聽……","","Voy a contar un chiste...","J'ai une bonne blague...","Ich hab hier einen Witz für dich&nbsp;…","Ho una barzelletta per te...","Eu tenho uma piada pra você!"
"CAT_EMBARK_QUOTES_JESTER_5","拉一下我的手指！","","¡Tírame del dedo!","Tire sur mon doigt&nbsp;!","Zieh an meinem Finger!","Tirami il dito!","Puxa meu dedo!"
"CAT_EMBARK_QUOTES_JESTER_6","你聽過這個嗎……","","¿Os sabéis este?...","Vous la connaissez certainement pas, celle-là...","Sag Bescheid, wenn du den schon kennst&nbsp;…","Dimmi se l'hai già sentita...","Diga-me se você já ouviu essa..."
"CAT_EMBARK_QUOTES_JESTER_7","有個人手臂夾著一隻鴨子走進酒吧……","","Un hombre entra en un bar con un pato debajo del brazo...","Alors, c'est un gars qui rentre dans un bar avec un canard sous le bras...","Geht ein Typ in eine Bar und hat eine Ente unterm Arm&nbsp;…","Un tizio entra in un bar con un'anatra sotto il braccio...","Então, um cara entra em um bar com um pato sob o braço..."
"CAT_EMBARK_QUOTES_JESTER_8","尾巴到底是怎樣？我說得對吧？","","¿A qué viene tanto rollo con las colas?","Quoi&nbsp;? Feur&nbsp;!","Was ist nur mit Katzenschwänzen los? Oder?","Che roba le code, eh? Ho ragione?","O que há com as caudas, não é mesmo?"
"CAT_EMBARK_QUOTES_JESTER_9","你覺得我是笑話嗎？","","¿Tengo monos en la cara?","J'ai l'air de plaisanter&nbsp;?","Bin ich nichts als ein Witz für dich?","Sono un buffone per te?","Eu tenho cara de palhaço?"
"CAT_EMBARK_QUOTES_COLORLESS_1","喵！","","¡Miau!","Miaou&nbsp;!","Miau!","Miao!","Miau!"
"CAT_EMBARK_QUOTES_COLORLESS_2","咪嗚咪嗚！","","¡Miau, miau!","Miaou, miaou&nbsp;!","Mau-mau!","Miao miao!","Mew mew!"
"CAT_EMBARK_QUOTES_COLORLESS_3","喵嗚——！","","¡Miauuuu!","Miaouuu&nbsp;!","Miiiiauuu!","Miaaaao!","Miaaauu!"
"CAT_EMBARK_QUOTES_COLORLESS_4","吼！","","¡Rrrr rrrr!","Raouh&nbsp;!","Grrr!","Rarrrr!","Rar!"
"CAT_EMBARK_QUOTES_COLORLESS_5","嘶嘶嘶！","","¡Fuuuuu!","Sshhh&nbsp;!","Hssssss!","Hisssss!","Hisssss!"
"CAT_EMBARK_QUOTES_COLORLESS_6","汪汪！","","¡Guau, guau!","Ouaf, ouaf&nbsp;!","Wuff-wuff!","Bau bau!","Au! Au!"
"CAT_EMBARK_QUOTES_COLORLESS_7","喵喵喵！","","¡Miau, miau, miau!","Miaou, miaou, miaou&nbsp;!","Miau-miau-miau!","Miao miao miao!","Miau miau miau!"
"CAT_EMBARK_QUOTES_COLORLESS_8","呸！","","¡Puaj!","Crotte&nbsp;!","Ich spuck dich an!","Sputo!","Cuspe!"
"CAT_RETURN_EARLY_QUOTES_FIGHTER_1","明明還有好多東西可以揍……","","Con la de cosas que quedaban por romper a puñetazos...","Il restait encore tellement de trucs à cogner...","Es gibt noch so viele unpolierte Fressen&nbsp;…","C'erano ancora tante altre cose da prendere a pugni...","Ainda havia tantas coisas para socar..."
"CAT_RETURN_EARLY_QUOTES_FIGHTER_2","等等……我們為什麼要回家？","","Quietos paraos. ¿Por qué volvemos a casa?","Minute... On rentre déjà&nbsp;?!","Moment&nbsp;… Warum gehen wir nach Hause?","Aspetta... perché stiamo tornando a casa?","Espera... nós estamos indo para casa?"
"CAT_RETURN_EARLY_QUOTES_FIGHTER_3","我們是魯蛇！魯蛇！！","","¡HEMOS PERDIDO! ¡SOMOS UNOS PRINGAOS!","ON EST DES NAZES&nbsp;! DES NAZES&nbsp;!!","WIR SIND VERLIERER! VERLIERER!!!","SIAMO DEI PERDENTI! DEI PERDENTI!!","NÓS SOMOS PERDEDORES! PERDEDORES!"
"CAT_RETURN_EARLY_QUOTES_FIGHTER_4","我們本來可以再推進一點的！","","¡Nos ha faltado empuje!","On aurait pu continuer d'avancer&nbsp;!","Wir hätten noch mehr geschafft!","Avremmo dovuto continuare!","Nós deveríamos ter nos esforçado mais!"
"CAT_RETURN_EARLY_QUOTES_FIGHTER_5","我不想說了……","","Paso de hablar más...","Assez parlé...","Ich habe keine Worte&nbsp;…","Basta chiacchiere...","Cansei de falar..."
"CAT_RETURN_EARLY_QUOTES_FIGHTER_6","搞什麼鬼！？","","Pero ¿qué bigotes?...","C'est quoi ce bin's&nbsp;?!","Was zur Hölle?","Ma che diavolo?!","Que diabos?!"
"CAT_RETURN_EARLY_QUOTES_HUNTER_1","前路太危險了。","","El camino era demasiado peligroso.","Le chemin qui s'annonçait était trop périlleux.","Der Weg vor uns war zu gefährlich.","Il cammino davanti a noi era troppo pericoloso.","O caminho adiante era perigoso demais."
"CAT_RETURN_EARLY_QUOTES_HUNTER_2","至少我抓到跳蚤了！","","Al menos me llevo un puñado de pulgas.","Bon, au moins j'ai eu des puces&nbsp;!","Wenigstens habe ich jetzt Flöhe!","Beh, almeno ho le pulci!","Bem, pelo menos eu peguei pulgas!"
"CAT_RETURN_EARLY_QUOTES_HUNTER_3","這麼早回家？我才剛熱身！","","¿Volvemos ya? ¡Pero si aún estaba calentando!","On rentre déjà&nbsp;? Je m'échauffais tout juste&nbsp;!","Schon? Dabei hatte ich gerade erst angefangen!","Già torniamo a casa? Mi stavo giusto riscaldando!","Tão cedo para casa? Eu estava só começando!"
"CAT_RETURN_EARLY_QUOTES_HUNTER_4","我覺得我們本來做得到……","","Podíamos haber salido victoriosos...","Je pense qu'on aurait pu continuer...","Ich glaube, wir hätten es schaffen können&nbsp;…","Penso che avremmo potuto farcela...","Acho que nós teríamos conseguido..."
"CAT_RETURN_EARLY_QUOTES_HUNTER_5","我想回家的路是這邊……","","Por aquí se vuelve a casa..., si no me equivoco.","On est sur la bonne voie pour rentrer...","Ich glaube, hier geht‘s nach Hause&nbsp;…","Penso che sia la strada giusta per tornare a casa...","Acho que este é o caminho certo para casa..."
"CAT_RETURN_EARLY_QUOTES_MAGE_1","下次我們多動點腦吧。","","La próxima aventura hay que planearla mejor.","On fera un peu plus tourner nos neurones la prochaine fois.","Lass uns nächstes Mal besser planen.","Rilflettiamo un po' di più la prossima volta.","Vamos pensar um pouco mais na próxima vez."
"CAT_RETURN_EARLY_QUOTES_MAGE_2","我有點後悔……","","Tengo unos cuantos reproches...","J'ai des regrets...","Bedauerlich&nbsp;…","Ho dei rimpianti...","Eu tenho arrependimentos..."
"CAT_RETURN_EARLY_QUOTES_MAGE_3","難以置信！","","¡Inconcebible!","C'est inconcevable&nbsp;!","Unvorstellbar!","Inconcepibile!","Inconcebível!"
"CAT_RETURN_EARLY_QUOTES_MAGE_4","反正這又不是我的錯！","","¡Pues culpa mía no ha sido!","Eh bien, je n'y suis pour rien&nbsp;!","Das war nicht mein Fehler!","Beh, non è stata colpa mia!","Bem, a culpa não foi minha!"
"CAT_RETURN_EARLY_QUOTES_MAGE_5","我法力用光了……","","Me he quedado sin maná.","J'étais à court de mana...","Das Mana ist mir ausgegangen&nbsp;…","Ho finito il mana...","Minha mana acabou..."
"CAT_RETURN_EARLY_QUOTES_MEDIC_1","我們的傷口需要時間癒合。","","Nuestras heridas necesitan tiempo para curarse.","Il va falloir du temps pour récupérer de nos blessures.","Unsere Wunden benötigen Zeit, vollständig zu heilen.","Le nostre ferite hanno bisogno di tempo per guarire.","Nossas feridas precisam de tempo para se curar."
"CAT_RETURN_EARLY_QUOTES_MEDIC_2","至少我們沒全滅……","","Por lo menos no la hemos palmado todos...","Au moins, on est pas tous morts...","Wenigstens sind wir nicht alle tot&nbsp;…","Beh, almeno non siamo tutti morti...","Bem, pelo menos nem todos morreram..."
"CAT_RETURN_EARLY_QUOTES_MEDIC_3","讓我們悼念逝者……","","Honremos a los gatos caídos...","N'oublions pas nos compagnons qui ont trépassé...","Gedenken wir den Gefallenen&nbsp;…","Ricordiamo i caduti...","Vamos nos lembrar dos que caíram..."
"CAT_RETURN_EARLY_QUOTES_MEDIC_4","主啊，請賜我們平安回家的路！","","Oh, Señor, llévanos a casa sanos y salvos.","Protège-nous sur le chemin du retour, ô Seigneur&nbsp;!","Geleite uns auf diesem Pfad, o Herr!","Concedici un passaggio sicuro verso casa, nostro Signore!","Oh, Senhor, conceda-nos uma viagem segura para casa!"
"CAT_RETURN_EARLY_QUOTES_MEDIC_5","我的神保佑了我們，我們必須感謝祂！","","Mi Dios nos ha perdonado la vida. ¡Démosle gracias!","Louons le Seigneur, il nous a protégés&nbsp;!","Mein Gott hat uns verschont. Dank sei Ihm!","Il mio Dio ci ha risparmiati, dobbiamo rendere grazie!","Meu Senhos nos poupou. Devemos agradecer a ele!"
"CAT_RETURN_EARLY_QUOTES_TANK_1","我最多只能保護到這裡了。","","No puedo protegeros eternamente.","J'ai fait de mon mieux pour protéger tout le monde.","Ich konnte uns nicht beschützen.","Ho potuto offrire protezione solo fino a un certo punto.","Eu fiz tudo que pude para nos proteger."
"CAT_RETURN_EARLY_QUOTES_TANK_2","呃，我討厭走路……","","Puf, me repatea caminar...","Argh, je déteste marcher...","Mann, ich hasse wandern&nbsp;…","Ugh, odio camminare...","Ugh, eu odeio andar..."
"CAT_RETURN_EARLY_QUOTES_TANK_3","我沒事啊……我們幹嘛要走？","","Pero ¿por qué nos vamos? Yo estoy como una rosa.","Moi, je vais bien... Pourquoi on s'en va&nbsp;?","Mir geht es gut&nbsp;… Warum hauen wir ab?","Sto bene... perché ce ne andiamo?","Eu estou bem, por que vamos embora?"
"CAT_RETURN_EARLY_QUOTES_TANK_4","走慢點！","","¡Echad el freno!","Attendez-moi&nbsp;!","Halt, Stopp!","Rallenta!","Mais devagar!"
"CAT_RETURN_EARLY_QUOTES_TANK_5","我得減肥了……","","Tengo que perder unos kilitos...","J'ai vraiment besoin d'un régime...","Ich muss echt abnehmen&nbsp;…","Devo perdere peso...","Preciso perder peso..."
"CAT_RETURN_EARLY_QUOTES_TANK_6","到了沒啊？","","¿Hemos llegado?","C'est bon, on y est&nbsp;?","Sind wir schon da?","Siamo già arrivati?","Já chegamos?"
"CAT_RETURN_EARLY_QUOTES_TANK_7","最後到家的就是大肥豬……我就是大肥豬。","","El último en llegar es un cerdo seboso... Anda, igual que yo.","Le dernier arrivé est un gros cochon... Je suis un gros cochon.","Der Letzte ist ein dickes, fettes Schwein&nbsp;… Oh warte, ich bin das dicke, fette Schwein.","L'ultimo che arriva a casa è un grosso maiale grasso... io sono un grosso maiale grasso.","Quem chegar por último é um porco gordo... Eu sou um porco gordo."
"CAT_RETURN_EARLY_QUOTES_THIEF_1","有撈到，該撤了。","","Ha sido saquear y salir por patas.","Je pille, je file.","Beute geschnappt und heil entkommen.","Bottino preso, via di corsa.","Peguei o tesouro e fui embora."
"CAT_RETURN_EARLY_QUOTES_THIEF_2","哇，這也太快了……","","Pues se me ha hecho corto...","Eh ben, c'était rapide...","Das war schnell&nbsp;…","Beh, è durata poco...","Bem, até que foi rápido..."
"CAT_RETURN_EARLY_QUOTES_THIEF_3","至少我們有拿到錢！","","Por lo menos hemos cobrado.","Au moins, on rentre pas les mains vides&nbsp;!","Wenigstens wurden wir bezahlt!","Almeno siamo stati pagati!","Pelo menos fomos pagos!"
"CAT_RETURN_EARLY_QUOTES_THIEF_4","別怪我！我自己打得好好的！","","¡A mí no me miréis, que bastante tenía con lo mío!","C'est pas ma faute&nbsp;! Je m'en sortais très bien&nbsp;!","Das war nicht meine schuld! Ich hab gut gekämpft!","Non dare la colpa a me! Ho fatto quel che potevo!","Não olhem para mim, eu estava dando conta!"
"CAT_RETURN_EARLY_QUOTES_THIEF_5","等等不行……我們漏掉好多硬幣！","","Esperad, que nos hemos dejado un porretón de monedas.","Oh, non... il restait tellement de pièces à choper&nbsp;!","Hey, warte&nbsp;… Da waren noch so viel glänzende Münzen!","Aspetta, no... abbiamo lasciato indietro così tante monete!","Esperem, não... nós deixamos tantas moedas para trás!"
"CAT_RETURN_EARLY_QUOTES_NECROMANCER_1","死亡不會嚇到我，但我還是比較不想死。","","La muerte no me asusta, pero prefiero no morir.","La mort ne me fait pas peur, mais je préférerais quand même ne pas mourir.","Der Tod macht mir keine Angst. Ich ziehe es trotzdem vor, zu überleben.","La morte non mi spaventa, ma preferirei comunque non morire.","A morte não me assusta, mas mesmo assim eu preferiria não morrer."
"CAT_RETURN_EARLY_QUOTES_NECROMANCER_2","至少我有收集到幾個靈魂……","","Por lo menos he pillado unas cuantas almas...","Au moins, j'ai récolté quelques âmes...","Wenigstens habe ich ein paar Seelen geerntet&nbsp;…","Almeno ho raccolto qualche anima...","Pelo menos conseguimos algumas almas..."
"CAT_RETURN_EARLY_QUOTES_NECROMANCER_3","咕噥咕噥……","","Grrr, grrr...","*Grogne*","Grummel, grummel&nbsp;…","*groan*","*Resmungo*..."
"CAT_RETURN_EARLY_QUOTES_NECROMANCER_4","我怕死亡仍在追著我們。","","La muerte nos sigue los pasos.","Je crains que la mort nous suive encore.","Der Tod ist uns noch immer auf den Spuren.","Temo che la morte ci stia ancora seguendo.","Temo que a morte ainda esteja nos seguindo."
"CAT_RETURN_EARLY_QUOTES_NECROMANCER_5","你逃不過命運。","","Nadie escapa del destino.","Personne n'échappe au destin.","Man kann seinem Schicksal nicht entkommen.","Non si può sfuggire al destino.","Não é possível fugir do destino."
"CAT_RETURN_EARLY_QUOTES_NECROMANCER_6","烏鴉說：永不復返。","","Dijo el cuervo: «Nunca más».","Le corbeau répond&nbsp;: «&nbsp;Jamais plus&nbsp;».","Sprach der Rabe: Nimmermehr.","E il corvo: non più mai.","E disse o corvo: ""nunca mais""."
"CAT_RETURN_EARLY_QUOTES_PSYCHIC_1","我預見的未來沒有勝利之路……撤退是最安全的選擇。","","No había senderos de gloria en nuestro futuro... Una retirada a tiempo es una victoria.","Je n'entrevoyais aucune voie vers la victoire dans notre avenir... la retraite était l'option la plus sûre.","In unserer Zukunft gab es keinen Weg zum Sieg&nbsp;… Rückzug war die einzige Möglichkeit.","Non ho visto alcun cammino per la vittoria nel nostro futuro... la ritirata era l'opzione più sicura.","Eu não pude prever nenhum caminho para a vitória... Recuar era a opção mais segura."
"CAT_RETURN_EARLY_QUOTES_PSYCHIC_2","我就知道會這樣……","","Sabía que ocurriría algo así.","Je savais que ça arriverait...","Ich wusste, dass das passieren würde&nbsp;…","Sapevo che sarebbe successo...","Eu sabia que isso acontecer..."
